{
  "schema_version": 1,
  "task_id": "astr-trailer-tridem-3",
  "title": "Astr trailer tridem 3",
  "objective": "Create a three-slot, three-axle pneumatic drawbar trailer from the accepted Tandem-2 for astr_trailers, with adjustable height and independent front axle lift.",
  "status": "active",
  "phase": "intake",
  "revision": 1,
  "created_at": "2026-09-28T08:39:28Z",
  "updated_at": "2026-09-28T08:39:28Z",
  "scope_paths": [
    "SnowRunner-Modding/objects/trailers/trailer_sideboard_tridem_3",
    "SnowRunner-Modding/docs/ASTR_TRAILER_TRIDEM_3_PLAN.md"
  ],
  "authority": {
    "constraints": [
      "Do not alter accepted Tandem-2 or installed astr_trailers; no proxy geometry; source rights pending."
    ],
    "open_questions": [
      "User review of three-slot form and axle placement after visual inspection."
    ]
  },
  "accepted_work": {
    "summary": "Verified source copies, design and budget reports, Blender working scene with main-pin optimization only, and separate non-exportable rail geometry WIP. No Tridem XML, Editor test, game test, or release.",
    "working_path": "SnowRunner-Modding/objects/trailers/trailer_sideboard_tridem_3",
    "captured_at": "2026-09-28T08:39:25Z",
    "git": null
  },
  "context": {
    "current_summary": "Verified source copies, design and budget reports, Blender working scene with main-pin optimization only, and separate non-exportable rail geometry WIP. No Tridem XML, Editor test, game test, or release.",
    "decisions": [],
    "completed": [
      "Принято текущее состояние работы."
    ],
    "next_actions": [
      "Present current Blender WIP views and collect the user's Tridem geometry ideas."
    ],
    "files": [],
    "evidence": []
  },
  "model_routes": {
    "architecture": "gpt-6-astra",
    "xml_and_scripts": "gpt-5.6-terra",
    "analysis": "gpt-5.6-sol",
    "summary": "gpt-5.6-luna"
  }
}
